
DEVICE PHASE DATA           
------ ----- ------------------------ 
 51  IN   00            
 50  IN   00            
 50  IN   01 03 0C 00        
 51  IN   04 0F 04 00 01 00 00   
 50  IN   01 03 0C 00        
 50  IN   01 00 FC 13 C2 02 00 09 00 1E 00 03 70 00 00 FE 01 01 00 00 00 90 65   
 51  IN   04 0E 04 01 03 0C 00 
 					04 FF 13 C2 01 00 09 00 1E 00 03 70 00 00 FE 01 01 00 00 00 90 65      
 50  IN   01 00 FC 13 C2 02 00 09 00 04 00 03 70 00 00 F9 01 01 00 00 00 03 00 
 					01 00 FC 13 C2 02 00 09 00 05 00 03 70 00 00 C0 01 01 00 00 00 A8 08 
 					01 00 FC 19 C2 02 00 0C 00 08 00 03 70 00 00 01 00 04 00 00 00 3C 00 1F F1 B8 00 64 DC         
 51  IN   04 FF 13 C2 01 00 09 00 04 00 03 70 00 00 F9 01 01 00 00 00 03 00 
 					04 FF 13 C2 01 00 09 00 05 00 03 70 00 00 C0 01 01 00 00 00 A8 08 
 					04 FF 19 C2 01 00 0C 00 08 00 03 70 00 00 01 00 04 00 00 00 3C 00 1F F1 B8 00 64 DC 
 50  IN   01 00 FC 15 C2 02 00 0A 00 09 00 03 70 00 00 EA 01 02 00 00 00 01 00 00 C2 
 					01 00 FC 13 C2 02 00 09 00 4D 0E 02 40 00 00 00 00 00 00 00 00 00 00 
 51  IN   04 FF 15 C2 01 00 0A 00 09 00 03 70 00 00 EA 01 02 00 00 00 01 00 00 C2 
 50  IN   01 00 FC 13 C2 02 00 09 00 A0 00 04 50 00 00 1D 00 3A 00 00 00 00 00   
 50  IN   01 09 10 00 
 					01 05 10 00 
 					01 03 10 00 
 					01 01 0C 08 FF FF FF FF FF FF FF 3F 
 					01 18 0C 02 00 20    
 51  IN   04 FF 13 C2 01 00 09 00 A0 00 04 50 00 00 1D 00 3A 00 00 00 00 00 
 					04 0F 04 00 01 00 00 
 					04 0E 0A 01 09 10 00 1F F1 3C B8 64 DC 
 					04 0E 0B 01 05 10 00 36 01 40 0A 00 08 00 
 					04 0E 0C 01 03 10 00 FF FF 8F FE DB FF 5B 87 
 					04 0E 04 01 01 0C 00    
 50  IN   01 24 0C 03 04 04 24 
 					01 13 0C F8 49 50 4F 53 30 32 32 30 34 32 37 32 00 00 00 00 00 00 00 00 00 00 00 00 00 00 00 00 00 00 00 00 00 00 00 00 00 00 00 00 00 00 00 00 00 00 00 00 00 00 00 00 00 00 00 00 00 00 00 00 00 00 00 00 00 00 00 00 00 00 00 00 00 00 00 00 00 00 00 00 00 00 00 00 00 00 00 00 00 00 00 00 00 00 00 00 00 00 00 00 00 00 00 00 00 00 00 00 00 00 00 00 00 00 00 00 00 
 51  IN   04 0E 04 01 18 0C 00 
 					04 0E 04 01 24 0C 00    
 51  IN   04 0E 04 01 13 0C 00 
 					04 0E 04 01 20 0C 00 
 					04 0E 04 01 1E 0C 00 
 					04 0E 04 01 1C 0C 00 
 					04 0E 04 01 45 0C 00         
 50  IN   00 00 00 00 00 00 00 00 00 00 00 00 00 00 00 00 00 00 00 00 00 00 00 00 00 00 00 00 00 00 00 00 00 00 00 00 00 00 00 00 00 00 00 00 00 00 00 00 00 00 00 00 00 00 00 00 00 00 00 00 
 					01 20 0C 01 00 
 					01 1E 0C 04 00 02 12 00 
 					01 1C 0C 04 90 00 12 00 
 					01 45 0C 01 02 
 					01 52 0C F1 01 0D 09 49 50 4F 53 30 32 32 30 34 32 37 32 00 00 00 00 00 00 00 00 00 00 00 00 00    
 50  IN   00 00 00 00 00 00 00 00 00 00 00 00 00 00 00 00 00 00 00 00 00 00 00 00 00 00 00 00 00 00 00 00 00 00 00 00 00 00 00 00 00 00 00 00 00 00 00 00 00 00 00 00 00 00 00 00 00 00 00 00 00 00 00 00 00 00 00 00 00 00 00 00 00 00 00 00 00 00 00 00 00 00 00 00 00 00 00 00 00 00 00 00 00 00 00 00 00 00 00 00 00 00 00 00 00 00 00 00 00 00 00 00 00 00 00 00 00 00 00 00 00 00 00 00 00 00 00 00 
 51  IN   04 0E 04 01 52 0C 00 
 					04 0E 04 01 1A 0C 00    
 50  IN   00 00 00 00 00 00 00 00 00 00 00 00 00 00 00 00 00 00 00 00 00 00 00 00 00 00 00 00 00 00 00 00 00 00 00 00 00 00 00 00 00 00 00 00 00 00 00 00 00 00 00 00 00 
 					01 1A 0C 01 00 
 					01 02 20 00 
 					01 6D 0C 02 01 00        
 51  IN   04 0E 07 01 02 20 00 00 00 00 
 					04 0E 04 01 6D 0C 00 
 					04 0E 04 01 0B 20 00 
 					04 0E 04 01 1A 0C 00 
 					04 0E 04 01 08 20 00    
 50  IN   01 0B 20 07 01 E0 01 30 00 00 00 
 					01 1A 0C 01 03 
 					01 08 20 20 12 02 01 01 0E 09 49 50 4F 53 30 32 32 30 34 32 37 32 00 00 00 00 00 00 00 00 00 00 00 00 00 00 
 					01 09 20 20 1F 02 01 01 0E 09 49 50 4F 53 30 32 32 30 34 32 37 32 00 00 00 00 00 00 00 00 00 00 00 00 00 00 
 51  IN   04 0E 04 01 09 20 00 
 					04 0E 04 01 0A 20 00    
 50  IN   01 0A 20 01 01      
