Bus Hound 6.01 capture on Windows Vista (x64). Complements of www.perisoft.net

连接

 Device - Device ID (followed by the endpoint for USB devices)
      (21) USB 串行设备 (COM18)
      (24) USB-SERIAL CH340 (COM5)
      (50) USB-SERIAL CH340
      (51) USB-SERIAL CH341A
 Phase - Phase Type
      IN  Data in transfer      
 Data  - Hex dump of the data transferred
 Descr - Description of the phase
 Cmd... - Position in the captured data


DEVICE PHASE DATA           
------ ----- ------------------------ 
 51  IN   04 04 0A 7D B5 1C A3 55 D8 0C 02 5A 01 
 					04 0F 04 00 01 09 04        
 50  IN   01 09 04 07 7D B5 1C A3 55 D8 01         
 50  IN   01 1A 0C 01 02 01 19 
 					04 0A 7D B5 1C A3 55 D8 00 00 00 00 
 					01 1B 04 02 45 00 
 					01 0A 20 01 00    
 51  IN   04 03 0B 00 45 00 7D B5 1C A3 55 D8 01 00 
 					04 20 07 7D B5 1C A3 55 D8 01 
 					04 0E 04 01 1A 0C 00 
 					04 0F 04 00 01 19 04 
 					04 0F 04 00 00 1B 04 
 					04 38 04 45 00 40 1F 
 					04 0E 04 00 0A 20 00 
 					04 1B 03 45 00 05            
 51  IN   04 07 FF 00 7D B5 1C A3 55 D8 6E 75 62 69 61 20 5A 37 20 6D 69 6E 69 00 00 00 00 00 00 00 00 00 00 00 00 00 00 00 00 00 00 00 00 00 00 00 00 00 00 00 00 00 00 00 00 00 00 00 00 00 00 00 00 00 00 00 00 00 00 00 00 00 00 00 00 00 00 00 00 00 00 00 00 00 00 00 00 00 00 00 00 00 00 00 00 00 00 00 00 00 00 00 00 00 00 00 00 00 00 00 00 00 00 00 00 00 00 00 00 00 00 00 00 00 00 00 00 00 
 51  IN   00 00 00 00 00 00 00 00 00 00 00 00 00 00 00 00 00 00 00 00 00 00 00 00 00 00 00 00 00 00 00 00 00 00 00 00 00 00 00 00 00 00 00 00 00 00 00 00 00 00 00 00 00 00 00 00 00 00 00 00 00 00 00 00 00 00 00 00 00 00 00 00 00 00 00 00 00 00 00 00 00 00 00 00 00 00 00 00 00 00 00 00 00 00 00 00 00 00 00 00 00 00 00 00 00 00 00 00 00 00 00 00 00 00 00 00 00 00 00 00 00 00 00 00 00 00 00 00 
 50  IN   02 45 00 10 00 0C 00 01 00 0B 02 08 00 02 00 00 00 00 00 00 80      
 50  IN   02 45 00 10 00 0C 00 01 00 03 03 08 00 43 00 45 00 00 00 00 00 
 					02 45 00 10 00 0C 00 01 00 04 03 08 00 45 00 00 00 01 02 28 01           
 51  IN   02 45 20 0C 00 08 00 01 00 02 03 04 00 01 00 45 00 
 					04 13 05 01 45 00 01 00 
 					02 45 20 10 00 0C 00 01 00 04 04 08 00 43 00 00 00 01 02 A0 02    
 51  IN   04 13 05 01 45 00 01 00 
 					04 13 05 01 45 00 01 00 
 					02 45 20 0E 00 0A 00 01 00 05 03 06 00 43 00 00 00 00 00 
 					04 13 05 01 45 00 01 00 
 					02 45 20 26 00 22 00 43 00 06 00 00 00 1D 35 11 1C 00 00 11 01 00 00 10 00 80 00 00 80 5F 9B 34 FB 02 90 35 05 0A 00 00 FF FF 00    
 50  IN   02 45 00 12 00 0E 00 01 00 05 04 0A 00 45 00 00 00 00 00 01 02 A0 02 
 					02 45 00 66 00 
 					62 00 45 00 07 00 00 00 5D 00 5A 36 00 57 36 00 
 					54 09 00 00 0A 00 01 00 01 09 00 01 36 00 03 19 
 					11 01 09 00 04 36 00 0E 36 00 03 19 01 00 36 00 
 					05 19 00 03 08 01 09 00 05 36 00 03 19 10 02 09 
 					00 06 36 00 09 09 65 6E 09 00 6A 09 01 00 09 00 
 					09 36 00 09 36 00 06 19 11 01 09   
 50  IN   01 00 09 01 00 25 03 53 50 50 00         
 51  IN   04 13 05 01 45 00 01 00 
 					02 45 20 0C 00 08 00 01 00 06 05 04 00 43 00 45 00            
 50  IN   02 45 00 0C 00 08 00 01 00 07 05 04 00 43 00 45 00            
 51  IN   02 45 20 0C 00 08 00 01 00 02 06 04 00 03 00 46 00 
 					04 13 05 01 45 00 01 00 
 					02 45 20 10 00 0C 00 01 00 04 07 08 00 44 00 00 00 01 02 9B 06    
 50  IN   02 45 00 10 00 0C 00 01 00 03 06 08 00 44 00 46 00 00 00 00 00 
 					02 45 00 10 00 0C 00 01 00 04 04 08 00 46 00 00 00 01 02 28 01 
 					02 45 00 12 00 0E 00 01 00 05 07 0A 00 46 00 00 00 00 00 01 02 9B 06            
 51  IN   04 13 05 01 45 00 01 00 
 					04 13 05 01 45 00 01 00 
 					02 45 20 0E 00 0A 00 01 00 05 04 06 00 44 00 00 00 00 00 
 					04 13 05 01 45 00 01 00 
 					02 45 20 08 00 04 00 44 00 03 3F 01 1C 
 50  IN   02 45 00 08 00 04 00 46 00 03 73 01 D7      
 50  IN   02 45 00 12 00 0E 00 46 00 01 EF 15 81 11 02 E0 00 00 22 01 00 00 AA   
 50  IN   02 45 00 08 00 04 00 46 00 0B 73 01 92 
 					02 45 00 0C 00 08 00 46 00 01 EF 09 E3 05 0B 8D AA 
 					02 45 00 09 00 05 00 46 00 09 FF 01 30 5C 
 					02 45 00 0C 00 08 00 46 00 01 EF 09 E3 05 0B 8D AA 
 					02 45 00 0C 00 08 00 46 00 01 EF 09 E1 05 0B 8D AA    
 51  IN   04 13 05 01 45 00 01 00 
 					02 45 20 12 00 0E 00 44 00 03 EF 15 83 11 02 F0 00 00 DE 03 00 07 70 
 					04 13 05 01 45 00 01 00 
 					02 45 20 08 00 04 00 44 00 0B 3F 01 59 
 					02 45 20 0C 00 08 00 44 00 03 EF 09 E3 05 0B 8D 70      
 51  IN   04 13 05 01 45 00 01 00 
 					04 13 05 01 45 00 01 00 
 					04 13 05 01 45 00 01 00 
 					04 13 05 01 45 00 01 00 
 					04 13 05 01 45 00 01 00 
 					02 45 20 0C 00 08 00 44 00 03 EF 09 E1 05 0B 8D 70 
 					02 45 20 0C 00 08 00 44 00 03 EF 09 E1 05 0B 8D 70           
