Bus Hound 6.01 capture on Windows Vista (x64). Complements of www.perisoft.net

  Device - Device ID (followed by the endpoint for USB devices)
            (50) USB-SERIAL CH340（示意图中5号线）
            (51) USB-SERIAL CH341A（示意图中6号线）
  Phase  - Phase Type
            IN    Data in transfer           
  Data   - Hex dump of the data transferred
  Descr  - Description of the phase
  Cmd... - Position in the captured data


Device  Phase  Data                      Description       Cmd.Phase.Ofs(rep)
------  -----  ------------------------  ----------------  ------------------
  51    IN     00                        .                        1.1.0        
  50    IN     00                        .                        2.1.0        
  50    IN     01 03 0c 00               ....                     3.1.0(3)     
  51    IN     04 0f 04 00  01 00 00     .......                  6.1.0        
  50    IN     01 03 0c 00               ....                     7.1.0        
  50    IN     01 00 fc 13  c2 02 00 09  ........                 8.1.0        
               00 1e 00 03  70 00 00 fe  ....p...                 8.1.8        
               01 01 00 00  00 90 65     ......e                  8.1.16       
  51    IN     04 0e 04 01  03 0c 00 04  ........                 9.1.0        
               ff 13 c2 01  00 09 00 1e  ........                 9.1.8        
               00 03 70 00  00 fe 01 01  ..p.....                 9.1.16       
               00 00 00 90  65           ....e                    9.1.24       
  51    IN     04 ff 13 c2  01 00 09 00  ........                10.1.0        
               04 00 03 70  00 00 f9 01  ...p....                10.1.8        
               01 00 00 00  03 00 04 ff  ........                10.1.16       
               13 c2 01 00  09 00 05 00  ........                10.1.24       
  50    IN     01 00 fc 13  c2 02 00 09  ........                11.1.0        
               00 04 00 03  70 00 00 f9  ....p...                11.1.8        
               01 01 00 00  00 03 00 01  ........                11.1.16       
               00 fc 13 c2  02 00 09 00  ........                11.1.24       
  50    IN     01 00 fc 13  c2 02 00 09  ........                12.1.0        
               00 4d 0e 02  40 00 00 00  .M..@...                12.1.8        
               00 00 00 00  00 00 00     .......                 12.1.16       
  50    IN     01 00 fc 13  c2 02 00 09  ........                13.1.0        
               00 a0 00 04  50 00 00 1d  ....P...                13.1.8        
               00 3a 00 00  00 00 00     .:.....                 13.1.16       
  50    IN     01 09 10 00  01 05 10 00  ........                14.1.0        
  51    IN     04 ff 13 c2  01 00 09 00  ........                15.1.0        
               a0 00 04 50  00 00 1d 00  ...P....                15.1.8        
               3a 00 00 00  00 00 04 0f  :.......                15.1.16       
               04 00 01 00  00 04 0e 0a  ........                15.1.24       
  51    IN     04 0e 0b 01  05 10 00 36  .......6                16.1.0        
               01 40 0a 00  08 00 04 0e  .@......                16.1.8        
               0c 01 03 10  00 ff ff 8f  ........                16.1.16       
               fe db ff 5b  87 04 0e 04  ...[....                16.1.24       
  50    IN     01 03 10 00  01 01 0c 08  ........                17.1.0        
               ff ff ff ff  ff ff ff 3f  .......?                17.1.8        
               01 18 0c 02  00 20 01 24  ..... .$                17.1.16       
               0c 03 04 04  24 01 13 0c  ....$...                17.1.24       
  51    IN     04 0e 04 01  13 0c 00 04  ........                18.1.0        
               0e 04 01 20  0c 00        ... ..                  18.1.8        
  50    IN     00 00 00 00  00 00 00 00  ........                19.1.0        
               00 00 00 00  00 00 00 00  ........                19.1.8        
               00 00 00 00  00 00 00 00  ........                19.1.16       
               00 00 00 00  00 00 00 00  ........                19.1.24       
  51    IN     04 0e 04 01  1e 0c 00 04  ........                20.1.0        
               0e 04 01 1c  0c 00 04 0e  ........                20.1.8        
               04 01 45 0c  00           ..E..                   20.1.16       
  50    IN     01 1e 0c 04  00 02 12 00  ........                21.1.0        
               01 1c 0c 04  90 00 12 00  ........                21.1.8        
               01 45 0c 01  02 01 52 0c  .E....R.                21.1.16       
               f1 01 0d 09  49 50 4f 53  ....IPOS                21.1.24       
  50    IN     00 00 00 00  00 00 00 00  ........                22.1.0        
               00 00 00 00  00 00 00 00  ........                22.1.8        
               00 00 00 00  00 00 00 00  ........                22.1.16       
               00 00 00 00  00 00 00 00  ........                22.1.24       
  51    IN     04 0e 04 01  52 0c 00     ....R..                 23.1.0        
  51    IN     04 0e 04 01  1a 0c 00 04  ........                24.1.0        
               0e 07 01 02  20 00 00 00  .... ...                24.1.8        
               00 04 0e 04  01 6d 0c 00  .....m..                24.1.16       
               04 0e 04 01  0b 20 00 04  ..... ..                24.1.24       
  50    IN     01 1a 0c 01  00 01 02 20  .......                 25.1.0        
               00 01 6d 0c  02 01 00 01  ..m.....                25.1.8        
               0b 20 07 01  e0 01 30 00  . ....0.                25.1.16       
               00 00 01 1a  0c 01 03 01  ........                25.1.24       
  51    IN     04 0e 04 01  08 20 00 04  ..... ..                26.1.0        
               0e 04 01 09  20 00 04 0e  .... ...                26.1.8        
               04 01 0a 20  00           ... .                   26.1.16       
  50    IN     00 00 00 00  01 09 20 20  ......                  27.1.0        
               1f 02 01 01  0e 09 49 50  ......IP                27.1.8        
               4f 53 30 32  32 30 34 32  OS022042                27.1.16       
               37 32 00 00  00 00 00 00  72......                27.1.24       
