Bus Hound 6.01 capture on Windows Vista (x64). Complements of www.perisoft.net

连接

  Device - Device ID (followed by the endpoint for USB devices)
            (21) USB 串行设备 (COM18)
            (24) USB-SERIAL CH340 (COM5)
            (50) USB-SERIAL CH340
            (51) USB-SERIAL CH341A
  Phase  - Phase Type
            IN    Data in transfer           
  Data   - Hex dump of the data transferred
  Descr  - Description of the phase
  Cmd... - Position in the captured data


Device  Phase  Data                      Description       Cmd.Phase.Ofs(rep)
------  -----  ------------------------  ----------------  ------------------
  51    IN     04 04 0a 7d  b5 1c a3 55  .......U                 1.1.0        
               d8 0c 02 5a  01 04 0f 04  ...Z....                 1.1.8        
               00 01 09 04               ....                     1.1.16       
  50    IN     01 09 04 07  7d b5 1c a3  ........                 2.1.0        
               55 d8 01                  U..                      2.1.8        
  50    IN     01 1a 0c 01  02 01 19 04  ........                 3.1.0        
               0a 7d b5 1c  a3 55 d8 00  .....U..                 3.1.8        
               00 00 00 01  1b 04 02 45  .......E                 3.1.16       
               00 01 0a 20  01 00        ... ..                   3.1.24       
  51    IN     04 03 0b 00  45 00 7d b5  ....E...                 4.1.0        
               1c a3 55 d8  01 00 04 20  ..U....                  4.1.8        
               07 7d b5 1c  a3 55 d8 01  .....U..                 4.1.16       
               04 0e 04 01  1a 0c 00 04  ........                 4.1.24       
               0f 04 00 01  19 04 04 0f  ........                 4.1.32       
               04 00 00 1b  04 04 38 04  ......8.                 4.1.40       
               45 00 40 1f  04 0e 04 00  E.@.....                 4.1.48       
               0a 20 00 04  1b 03 45 00  . ....E.                 4.1.56       
               05                        .                        4.1.64       
  51    IN     04 07 ff 00  7d b5 1c a3  ........                 5.1.0        
               55 d8 6e 75  62 69 61 20  U.nubia                  5.1.8        
               5a 37 20 6d  69 6e 69 00  Z7 mini.                 5.1.16       
               00 00 00 00  00 00 00 00  ........                 5.1.24       
               00 00 00 00  00 00 00 00  ........                 5.1.32       
               00 00 00 00  00 00 00 00  ........                 5.1.40       
               00 00 00 00  00 00 00 00  ........                 5.1.48       
               00 00 00 00  00 00 00 00  ........                 5.1.56       
               00 00 00 00  00 00 00 00  ........                 5.1.64       
               00 00 00 00  00 00 00 00  ........                 5.1.72       
               00 00 00 00  00 00 00 00  ........                 5.1.80       
               00 00 00 00  00 00 00 00  ........                 5.1.88       
               00 00 00 00  00 00 00 00  ........                 5.1.96       
               00 00 00 00  00 00 00 00  ........                 5.1.104      
               00 00 00 00  00 00 00 00  ........                 5.1.112      
               00 00 00 00  00 00 00 00  ........                 5.1.120      
  51    IN     00 00 00 00  00 00 00 00  ........                 6.1.0        
               00 00 00 00  00 00 00 00  ........                 6.1.8        
               00 00 00 00  00 00 00 00  ........                 6.1.16       
               00 00 00 00  00 00 00 00  ........                 6.1.24       
               00 00 00 00  00 00 00 00  ........                 6.1.32       
               00 00 00 00  00 00 00 00  ........                 6.1.40       
               00 00 00 00  00 00 00 00  ........                 6.1.48       
               00 00 00 00  00 00 00 00  ........                 6.1.56       
               00 00 00 00  00 00 00 00  ........                 6.1.64       
               00 00 00 00  00 00 00 00  ........                 6.1.72       
               00 00 00 00  00 00 00 00  ........                 6.1.80       
               00 00 00 00  00 00 00 00  ........                 6.1.88       
               00 00 00 00  00 00 00 00  ........                 6.1.96       
               00 00 00 00  00 00 00 00  ........                 6.1.104      
               00 00 00 00  00 00 00 00  ........                 6.1.112      
               00 00 00 00  00 00 00 00  ........                 6.1.120      
  50    IN     02 45 00 10  00 0c 00 01  .E......                 7.1.0        
               00 0b 02 08  00 02 00 00  ........                 7.1.8        
               00 00 00 00  80           .....                    7.1.16       
  50    IN     02 45 00 10  00 0c 00 01  .E......                 8.1.0        
               00 03 03 08  00 43 00 45  .....C.E                 8.1.8        
               00 00 00 00  00 02 45 00  ......E.                 8.1.16       
               10 00 0c 00  01 00 04 03  ........                 8.1.24       
               08 00 45 00  00 00 01 02  ..E.....                 8.1.32       
               28 01                     (.                       8.1.40       
  51    IN     02 45 20 0c  00 08 00 01  .E .....                 9.1.0        
               00 02 03 04  00 01 00 45  .......E                 9.1.8        
               00 04 13 05  01 45 00 01  .....E..                 9.1.16       
               00 02 45 20  10 00 0c 00  ..E ....                 9.1.24       
               01 00 04 04  08 00 43 00  ......C.                 9.1.32       
               00 00 01 02  a0 02        ......                   9.1.40       
  51    IN     04 13 05 01  45 00 01 00  ....E...                10.1.0        
               04 13 05 01  45 00 01 00  ....E...                10.1.8        
               02 45 20 0e  00 0a 00 01  .E .....                10.1.16       
               00 05 03 06  00 43 00 00  .....C..                10.1.24       
               00 00 00 04  13 05 01 45  .......E                10.1.32       
               00 01 00 02  45 20 26 00  ....E &.                10.1.40       
               22 00 43 00  06 00 00 00  ".C.....                10.1.48       
               1d 35 11 1c  00 00 11 01  .5......                10.1.56       
               00 00 10 00  80 00 00 80  ........                10.1.64       
               5f 9b 34 fb  02 90 35 05  _.4...5.                10.1.72       
               0a 00 00 ff  ff 00        ......                  10.1.80       
  50    IN     02 45 00 12  00 0e 00 01  .E......                11.1.0        
               00 05 04 0a  00 45 00 00  .....E..                11.1.8        
               00 00 00 01  02 a0 02 02  ........                11.1.16       
               45 00 66 00  62 00 45 00  E.f.b.E.                11.1.24       
               07 00 00 00  5d 00 5a 36  ....].Z6                11.1.32       
               00 57 36 00  54 09 00 00  .W6.T...                11.1.40       
               0a 00 01 00  01 09 00 01  ........                11.1.48       
               36 00 03 19  11 01 09 00  6.......                11.1.56       
               04 36 00 0e  36 00 03 19  .6..6...                11.1.64       
               01 00 36 00  05 19 00 03  ..6.....                11.1.72       
               08 01 09 00  05 36 00 03  .....6..                11.1.80       
               19 10 02 09  00 06 36 00  ......6.                11.1.88       
               09 09 65 6e  09 00 6a 09  ..en..j.                11.1.96       
               01 00 09 00  09 36 00 09  .....6..                11.1.104      
               36 00 06 19  11 01 09     6......                 11.1.112      
  50    IN     01 00 09 01  00 25 03 53  .....%.S                12.1.0        
               50 50 00                  PP.                     12.1.8        
  51    IN     04 13 05 01  45 00 01 00  ....E...                13.1.0        
               02 45 20 0c  00 08 00 01  .E .....                13.1.8        
               00 06 05 04  00 43 00 45  .....C.E                13.1.16       
               00                        .                       13.1.24       
  50    IN     02 45 00 0c  00 08 00 01  .E......                14.1.0        
               00 07 05 04  00 43 00 45  .....C.E                14.1.8        
               00                        .                       14.1.16       
  51    IN     02 45 20 0c  00 08 00 01  .E .....                15.1.0        
               00 02 06 04  00 03 00 46  .......F                15.1.8        
               00 04 13 05  01 45 00 01  .....E..                15.1.16       
               00 02 45 20  10 00 0c 00  ..E ....                15.1.24       
               01 00 04 07  08 00 44 00  ......D.                15.1.32       
               00 00 01 02  9b 06        ......                  15.1.40       
  50    IN     02 45 00 10  00 0c 00 01  .E......                16.1.0        
               00 03 06 08  00 44 00 46  .....D.F                16.1.8        
               00 00 00 00  00 02 45 00  ......E.                16.1.16       
               10 00 0c 00  01 00 04 04  ........                16.1.24       
               08 00 46 00  00 00 01 02  ..F.....                16.1.32       
               28 01 02 45  00 12 00 0e  (..E....                16.1.40       
               00 01 00 05  07 0a 00 46  .......F                16.1.48       
               00 00 00 00  00 01 02 9b  ........                16.1.56       
               06                        .                       16.1.64       
  51    IN     04 13 05 01  45 00 01 00  ....E...                17.1.0        
               04 13 05 01  45 00 01 00  ....E...                17.1.8        
               02 45 20 0e  00 0a 00 01  .E .....                17.1.16       
               00 05 04 06  00 44 00 00  .....D..                17.1.24       
               00 00 00 04  13 05 01 45  .......E                17.1.32       
               00 01 00 02  45 20 08 00  ....E ..                17.1.40       
               04 00 44 00  03 3f 01 1c  ..D..?..                17.1.48       
  50    IN     02 45 00 08  00 04 00 46  .E.....F                18.1.0        
               00 03 73 01  d7           ..s..                   18.1.8        
  50    IN     02 45 00 12  00 0e 00 46  .E.....F                19.1.0        
               00 01 ef 15  81 11 02 e0  ........                19.1.8        
               00 00 22 01  00 00 aa     .."....                 19.1.16       
  50    IN     02 45 00 08  00 04 00 46  .E.....F                20.1.0        
               00 0b 73 01  92 02 45 00  ..s...E.                20.1.8        
               0c 00 08 00  46 00 01 ef  ....F...                20.1.16       
               09 e3 05 0b  8d aa 02 45  .......E                20.1.24       
               00 09 00 05  00 46 00 09  .....F..                20.1.32       
               ff 01 30 5c  02 45 00 0c  ..0\.E..                20.1.40       
               00 08 00 46  00 01 ef 09  ...F....                20.1.48       
               e3 05 0b 8d  aa 02 45 00  ......E.                20.1.56       
               0c 00 08 00  46 00 01 ef  ....F...                20.1.64       
               09 e1 05 0b  8d aa        ......                  20.1.72       
  51    IN     04 13 05 01  45 00 01 00  ....E...                21.1.0        
               02 45 20 12  00 0e 00 44  .E ....D                21.1.8        
               00 03 ef 15  83 11 02 f0  ........                21.1.16       
               00 00 de 03  00 07 70 04  ......p.                21.1.24       
               13 05 01 45  00 01 00 02  ...E....                21.1.32       
               45 20 08 00  04 00 44 00  E ....D.                21.1.40       
               0b 3f 01 59  02 45 20 0c  .?.Y.E .                21.1.48       
               00 08 00 44  00 03 ef 09  ...D....                21.1.56       
               e3 05 0b 8d  70           ....p                   21.1.64       
  51    IN     04 13 05 01  45 00 01 00  ....E...                22.1.0        
               04 13 05 01  45 00 01 00  ....E...                22.1.8        
               04 13 05 01  45 00 01 00  ....E...                22.1.16       
               04 13 05 01  45 00 01 00  ....E...                22.1.24       
               04 13 05 01  45 00 01 00  ....E...                22.1.32       
               02 45 20 0c  00 08 00 44  .E ....D                22.1.40       
               00 03 ef 09  e1 05 0b 8d  ........                22.1.48       
               70 02 45 20  0c 00 08 00  p.E ....                22.1.56       
               44 00 03 ef  09 e1 05 0b  D.......                22.1.64       
               8d 70                     .p                      22.1.72       
