Bus Hound 6.01 capture on Windows Vista (x64). Complements of www.perisoft.net

串口3

  Device - Device ID (followed by the endpoint for USB devices)
            (21) USB 串行设备 (COM18)
            (24) USB-SERIAL CH340 (COM5)
            (50) USB-SERIAL CH340
            (51) USB-SERIAL CH341A
  Phase  - Phase Type
            IN    Data in transfer           
  Data   - Hex dump of the data transferred
  Descr  - Description of the phase
  Cmd... - Position in the captured data


Device  Phase  Data                      Description       Cmd.Phase.Ofs(rep)
------  -----  ------------------------  ----------------  ------------------
  50    IN     00                        .                        1.1.0        
  51    IN     00                        .                        2.1.0        
  50    IN     01 03 0c 00               ....                     3.1.0(3)     
  51    IN     04 0f 04 00  01 00 00     .......                  6.1.0        
  50    IN     01 03 0c 00               ....                     7.1.0        
  51    IN     04 0e 04 01  03 0c 00     .......                  8.1.0        
  50    IN     01 00 fc 13  c2 02 00 09  ........                 9.1.0        
               00 1e 00 03  70 00 00 fe  ....p...                 9.1.8        
               01 01 00 00  00 90 65 01  ......e.                 9.1.16       
               00 fc 13 c2  02 00 09 00  ........                 9.1.24       
               04 00 03 70  00 00 f9 01  ...p....                 9.1.32       
               01 00 00 00  03 00        ......                   9.1.40       
  51    IN     04 ff 13 c2  01 00 09 00  ........                10.1.0        
               1e 00 03 70  00 00 fe 01  ...p....                10.1.8        
               01 00 00 00  90 65 04 ff  .....e..                10.1.16       
               13 c2 01 00  09 00 04 00  ........                10.1.24       
               03 70 00 00  f9 01 01 00  .p......                10.1.32       
               00 00 03 00  04 ff 13 c2  ........                10.1.40       
               01 00 09 00  05 00 03 70  .......p                10.1.48       
               00 00 c0 01  01 00 00 00  ........                10.1.56       
               a8 08                     ..                      10.1.64       
  50    IN     01 00 fc 13  c2 02 00 09  ........                11.1.0        
               00 05 00 03  70 00 00 c0  ....p...                11.1.8        
               01 01 00 00  00 a8 08 01  ........                11.1.16       
               00 fc 19 c2  02 00 0c 00  ........                11.1.24       
               08 00 03 70  00 00 01 00  ...p....                11.1.32       
               04 00 00 00  3c 00 1f f1  ....<...                11.1.40       
               b8 00 64 dc  01 00 fc 15  ..d.....                11.1.48       
               c2 02 00 0a  00 09 00 03  ........                11.1.56       
               70 00 00 ea  01 02 00 00  p.......                11.1.64       
               00 01 00 00  c2           .....                   11.1.72       
  51    IN     04 ff 19 c2  01 00 0c 00  ........                12.1.0        
               08 00 03 70  00 00 01 00  ...p....                12.1.8        
               04 00 00 00  3c 00 1f f1  ....<...                12.1.16       
               b8 00 64 dc  04 ff 15 c2  ..d.....                12.1.24       
               01 00 0a 00  09 00 03 70  .......p                12.1.32       
               00 00 ea 01  02 00 00 00  ........                12.1.40       
               01 00 00 c2               ....                    12.1.48       
  50    IN     01 00 fc 13  c2 02 00 09  ........                13.1.0        
               00 4d 0e 02  40 00 00 00  .M..@...                13.1.8        
               00 00 00 00  00 00 00     .......                 13.1.16       
  50    IN     01 00 fc 13  c2 02 00 09  ........                14.1.0        
               00 a0 00 04  50 00 00 1d  ....P...                14.1.8        
               00 3a 00 00  00 00 00     .:.....                 14.1.16       
  50    IN     01 09 10 00  01 05 10 00  ........                15.1.0        
               01 03 10 00               ....                    15.1.8        
  51    IN     04 ff 13 c2  01 00 09 00  ........                16.1.0        
               a0 00 04 50  00 00 1d 00  ...P....                16.1.8        
               3a 00 00 00  00 00 04 0f  :.......                16.1.16       
               04 00 01 00  00 04 0e 0a  ........                16.1.24       
               01 09 10 00  1f f1 3c b8  ......<.                16.1.32       
               64 dc 04 0e  0b 01 05 10  d.......                16.1.40       
               00 36 01 40  0a 00 08 00  .6.@....                16.1.48       
               04 0e 0c 01  03 10 00 ff  ........                16.1.56       
               ff 8f fe db  ff 5b 87     .....[.                 16.1.64       
  50    IN     01 01 0c 08  ff ff ff ff  ........                17.1.0        
               ff ff ff 3f  01 18 0c 02  ...?....                17.1.8        
               00 20 01 24  0c 03 04 04  . .$....                17.1.16       
               24 01 13 0c  f8 49 50 4f  $....IPO                17.1.24       
               53 30 32 32  30 34 32 37  S0220427                17.1.32       
               32 00 00 00  00 00 00 00  2.......                17.1.40       
               00 00 00 00  00 00 00 00  ........                17.1.48       
               00 00 00 00  00 00 00 00  ........                17.1.56       
               00 00 00 00  00 00 00 00  ........                17.1.64       
               00 00 00 00  00 00 00 00  ........                17.1.72       
               00 00 00 00  00 00 00 00  ........                17.1.80       
               00 00 00 00  00 00 00 00  ........                17.1.88       
               00 00 00 00  00 00 00 00  ........                17.1.96       
               00 00 00 00  00 00 00 00  ........                17.1.104      
               00 00 00 00  00 00 00 00  ........                17.1.112      
               00 00 00 00  00 00 00 00  ........                17.1.120      
  51    IN     04 0e 04 01  01 0c 00 04  ........                18.1.0        
               0e 04 01 18  0c 00 04 0e  ........                18.1.8        
               04 01 24 0c  00           ..$..                   18.1.16       
  51    IN     04 0e 04 01  13 0c 00 04  ........                19.1.0        
               0e 04 01 20  0c 00 04 0e  ... ....                19.1.8        
               04 01 1e 0c  00 04 0e 04  ........                19.1.16       
               01 1c 0c 00  04 0e 04 01  ........                19.1.24       
               45 0c 00                  E..                     19.1.32       
  50    IN     00 00 00 00  00 00 00 00  ........                20.1.0        
               00 00 00 00  00 00 00 00  ........                20.1.8        
               00 00 00 00  00 00 00 00  ........                20.1.16       
               00 00 00 00  01 20 0c 01  ..... ..                20.1.24       
               00 01 1e 0c  04 00 02 12  ........                20.1.32       
               00 01 1c 0c  04 90 00 12  ........                20.1.40       
               00 01 45 0c  01 02 01 52  ..E....R                20.1.48       
               0c f1 01 0d  09 49 50 4f  .....IPO                20.1.56       
               53 30 32 32  30 34 32 37  S0220427                20.1.64       
               32 00 00 00  00 00 00 00  2.......                20.1.72       
               00 00 00 00  00 00 00 00  ........                20.1.80       
               00 00 00 00  00 00 00 00  ........                20.1.88       
               00 00 00 00  00 00 00 00  ........                20.1.96       
               00 00 00 00  00 00 00 00  ........                20.1.104      
               00 00 00 00  00 00        ......                  20.1.112      
  50    IN     00 00 00 00  00 00 00 00  ........                21.1.0        
               00 00 00 00  00 00 00 00  ........                21.1.8        
               00 00 00 00  00 00 00 00  ........                21.1.16       
               00 00 00 00  00 00 00 00  ........                21.1.24       
               00 00 00 00  00 00 00 00  ........                21.1.32       
               00 00 00 00  00 00 00 00  ........                21.1.40       
               00 00 00 00  00 00 00 00  ........                21.1.48       
               00 00 00 00  00 00 00 00  ........                21.1.56       
               00 00 00 00  00 00 00 00  ........                21.1.64       
               00 00 00 00  00 00 00 00  ........                21.1.72       
               00 00 00 00  00 00 00 00  ........                21.1.80       
               00 00 00 00  00 00 00 00  ........                21.1.88       
               00 00 00 00  00 00 00 00  ........                21.1.96       
               00 00 00 00  00 00 00 00  ........                21.1.104      
               00 00 00 00  00 00 00 00  ........                21.1.112      
               00 00 00 00  00 00 00 00  ........                21.1.120      
  51    IN     04 0e 04 01  52 0c 00 04  ....R...                22.1.0        
               0e 04 01 1a  0c 00 04 0e  ........                22.1.8        
               07 01 02 20  00 00 00 00  ... ....                22.1.16       
  50    IN     00 00 00 00  00 00 00 00  ........                23.1.0        
               00 00 00 00  00 00 00 00  ........                23.1.8        
               00 00 00 00  00 01 1a 0c  ........                23.1.16       
               01 00 01 02  20 00 01 6d  .... ..m                23.1.24       
               0c 02 01 00  01 0b 20 07  ...... .                23.1.32       
               01 e0 01 30  00 00 00     ...0...                 23.1.40       
  51    IN     04 0e 04 01  6d 0c 00 04  ....m...                24.1.0        
               0e 04 01 0b  20 00 04 0e  .... ...                24.1.8        
               04 01 1a 0c  00 04 0e 04  ........                24.1.16       
               01 08 20 00  04 0e 04 01  .. .....                24.1.24       
               09 20 00 04  0e 04 01 0a  . ......                24.1.32       
               20 00                      .                      24.1.40       
  50    IN     01 1a 0c 01  03 01 08 20  .......                 25.1.0        
               20 12 02 01  01 0e 09 49   ......I                25.1.8        
               50 4f 53 30  32 32 30 34  POS02204                25.1.16       
               32 37 32 00  00 00 00 00  272.....                25.1.24       
               00 00 00 00  00 00 00 00  ........                25.1.32       
               00 01 09 20  20 1f 02 01  ...  ...                25.1.40       
               01 0e 09 49  50 4f 53 30  ...IPOS0                25.1.48       
               32 32 30 34  32 37 32 00  2204272.                25.1.56       
               00 00 00 00  00 00 00 00  ........                25.1.64       
               00 00 00 00  00 01 0a 20  .......                 25.1.72       
               01 01                     ..                      25.1.80       
